gate_removed	what_would_survive	example_entities	why_misleading	frozen_evidence
therapeutic_directionality	a real, reproducible cellular hit with no disease reversal	PAK2	PAK2 passes every technical gate; without the directionality gate it would read as advanceable	results/frozen/primary_comparison.tsv (PAK2 reversal +0.010, p=0.297)
broad_effect_and_essentiality_controls	broad chromatin / RNA / essential-machinery reversers	GNAS,STAT3,SMARCB1,TET2	high reversal driven by nonspecific broad suppression, not disease-specific biology	results/frozen/rejection_ledger.tsv (final_evidence_class=SAFETY_CONSTRAINED)
modality_review	immune-directional but undruggable transcription factors	KLF13,IRF9,ELF4	real immune-directional reversal + immune genetics, but no credible small-molecule modality	results/frozen/rejection_ledger.tsv (external_layer_verdict=NO_CREDIBLE_MODALITY)
finite_null_uncertainty_reporting	RICTOR matched-null significance read as decisive	RICTOR	point estimate p=0.040 looks firm, but the Wilson/bootstrap CI on 7/200 grazes 0.05-0.07	results/frozen/matched_null.tsv + rictor_matched_null_values.tsv
confound_decomposition	reversal mistaken for generic activation / broad suppression	RICTOR	without module-removal, a reversal could be dismissed as (or inflated by) nonspecific suppression	results/frozen/confound_decomposition.tsv (cell-cycle/activation removal delta ~ 0)
